{
  "schemaVersion": 1,
  "coreRef": "ed63e94de814ff1d4ea28cddfaba6939bc9df9ed",
  "coreTreeSha256": "ea6b4a04be6a1459caa1e9e23d3c59659a7c6cf65f39cb0222690602d2b77e34",
  "patches": [
    {
      "path": "patches/core/003-word-distributed-jc.patch",
      "sha256": "b91369a92089b039afd8be38cbadfa4020b9cbe4bed4a42538528cb5c83f1fa9",
      "purpose": "CORE-03: preserve paragraph distribute as Jc value 4; source-only candidate"
    }
  ]
}
